unique id,product_name,product_category,image,product_url,platform,description,price,brand,rating,discount,final_price,short_name,product id,reviews_with_sentiments
301,AW88 Women Solid Round Neck Cotton Blend Pink T-Shirt,Clothing ,https://m.media-amazon.com/images/I/61+Qgy7uraL._SX679_.jpg,https://www.ajio.com/jockey-aw88-super-combed-cotton-rich-relaxed-fit-curved-hem-styled-half-sleeve-t-shirt/p/465322450_peach?,Ajio,"Super combed cotton rich fabric, relaxed fit, round-neck, half sleeve, curved hem styling, label free for all day comfort.",549,Jockey,4.1,30%,384,T shirt,12,"[{""review"": ""The design is practical and the experience is excellent. The t shirt fits perfectly into my daily routine."", ""sentiment"": ""positive""}, {""review"": ""Super comfortable and clearly well-designed. The t shirt fits perfectly into my daily routine."", ""sentiment"": ""positive""}, {""review"": ""Feels well-built and definitely worth the price. The t shirt fits perfectly into my daily routine."", ""sentiment"": ""positive""}, {""review"": ""It makes everyday use noticeably better. The t shirt fits perfectly into my daily routine."", ""sentiment"": ""positive""}, {""review"": ""Works smoothly and feels very reliable in daily use. The t shirt fits perfectly into my daily routine."", ""sentiment"": ""positive""}, {""review"": ""Functional and usable for daily tasks. Using the t shirt feels okay overall."", ""sentiment"": ""neutral""}, {""review"": ""Good for casual use, but not long sessions. Using the t shirt feels okay overall."", ""sentiment"": ""neutral""}, {""review"": ""Usable, but not something I’d strongly recommend. The t shirt could use more refinement."", ""sentiment"": ""negative""}]"
302,Women Solid Ankle Length Leggings,Clothing ,https://assets-jiocdn.ajio.com/medias/sys_master/root/20230525/oh8R/646f15b6d55b7d0c63ed8058/-473Wx593H-464829353-navy-MODEL.jpg,https://www.ajio.com/clora-creation-leggings-with-elasticated-waist/p/464829353_navy?,Ajio,Product color may slightly vary due to photographic lighting sources or your monitor settings.,999,CLORA CREATION,3.3,50%,500,leggings,13,"[{""review"": ""Works smoothly and feels very reliable in daily use. The leggings fits perfectly into my daily routine."", ""sentiment"": ""positive""}, {""review"": ""The design is practical and the experience is excellent. The leggings fits perfectly into my daily routine."", ""sentiment"": ""positive""}, {""review"": ""It’s fine, but feels a bit plain at times. Using the leggings feels okay overall."", ""sentiment"": ""neutral""}, {""review"": ""Functional and usable for daily tasks. Using the leggings feels okay overall."", ""sentiment"": ""neutral""}, {""review"": ""Decent quality, though a few things could be better. Using the leggings feels okay overall."", ""sentiment"": ""neutral""}, {""review"": ""Usable, but not something I’d strongly recommend. The leggings could use more refinement."", ""sentiment"": ""negative""}, {""review"": ""The quality feels a bit disappointing. The leggings could use more refinement."", ""sentiment"": ""negative""}, {""review"": ""The quality feels a bit disappointing. The leggings could use more refinement."", ""sentiment"": ""negative""}]"
303,Puma Mens Fierce Runner Running Shoe,Footware,https://m.media-amazon.com/images/I/51hghCXDy8L._SY695_.jpg,https://www.myntra.com/sports-shoes/puma/puma-smooth-walk-men-running-shoes/20993444/buy,Ajio,"Embodying the spirit of running, these shoes are a blend of innovation and sophisticated craftsmanship, offering a luxurious yet grounded experience in every stride. Featuring a breathable mesh upper, these shoes guarantee fresh and cool feet throughout your run. The EVA midsole offers superior cushioning, absorbing shocks seamlessly, while the durable outsole provides excellent traction. Enhanced with a SoftFoam sockliner, your feet will enjoy plush comfort with each step.",4499,Puma,,64%,1619,shoes,14,"[{""review"": ""The quality feels premium and it performs exceptionally well. The shoes fits perfectly into my daily routine."", ""sentiment"": ""positive""}, {""review"": ""Works smoothly and feels very reliable in daily use. The shoes fits perfectly into my daily routine."", ""sentiment"": ""positive""}, {""review"": ""Works smoothly and feels very reliable in daily use. The shoes fits perfectly into my daily routine."", ""sentiment"": ""positive""}, {""review"": ""Functional and usable for daily tasks. Using the shoes feels okay overall."", ""sentiment"": ""neutral""}, {""review"": ""Works fine overall but doesn’t stand out much. Using the shoes feels okay overall."", ""sentiment"": ""neutral""}, {""review"": ""Good for casual use, but not long sessions. Using the shoes feels okay overall."", ""sentiment"": ""neutral""}, {""review"": ""Comfort is okay, but not great. The shoes could use more refinement."", ""sentiment"": ""negative""}, {""review"": ""The quality feels a bit disappointing. The shoes could use more refinement."", ""sentiment"": ""negative""}]"
304,ASICS Women Jolt 4 Running Shoe,Footware,https://m.media-amazon.com/images/I/61U7PxeHGeL._SY625_.jpg,Buy Black Sports Shoes for Women by ASICS Online | Ajio.com,Ajio,"The new JOLT 4 shoe is designed to help you run or walk more comfortably. This shoe combines an injection EVA midsole with a solid rubber outsole for improved durability. Drawing inspiration from our longstanding GT series, this trainer offers classic styling and a great fit",4499,Asics,4.1,55%,2025,shoes,15,"[{""review"": ""It makes everyday use noticeably better. The shoes fits perfectly into my daily routine."", ""sentiment"": ""positive""}, {""review"": ""Super comfortable and clearly well-designed. The shoes fits perfectly into my daily routine."", ""sentiment"": ""positive""}, {""review"": ""The design is practical and the experience is excellent. The shoes fits perfectly into my daily routine."", ""sentiment"": ""positive""}, {""review"": ""It makes everyday use noticeably better. The shoes fits perfectly into my daily routine."", ""sentiment"": ""positive""}, {""review"": ""Works smoothly and feels very reliable in daily use. The shoes fits perfectly into my daily routine."", ""sentiment"": ""positive""}, {""review"": ""Decent quality, though a few things could be better. Using the shoes feels okay overall."", ""sentiment"": ""neutral""}, {""review"": ""A simple product that meets basic expectations. Using the shoes feels okay overall."", ""sentiment"": ""neutral""}, {""review"": ""Comfort is okay, but not great. The shoes could use more refinement."", ""sentiment"": ""negative""}]"
305,Mochi Women Synthetic Leather Fashion Sandal,Footware,https://m.media-amazon.com/images/I/619oEpG0OkL._SY625_.jpg,Buy Beige Heeled Sandals for Women by Mochi Online | Ajio.com,Ajio,,2690,Mochi,4.5,,1614,Heels,16,"[{""review"": ""Perfect for everyday use and extremely reliable. The heels fits perfectly into my daily routine."", ""sentiment"": ""positive""}, {""review"": ""Looks great and performs even better. The heels fits perfectly into my daily routine."", ""sentiment"": ""positive""}, {""review"": ""One of the best products I’ve used in this category. The heels fits perfectly into my daily routine."", ""sentiment"": ""positive""}, {""review"": ""Outstanding performance and completely exceeded expectations. The heels fits perfectly into my daily routine."", ""sentiment"": ""positive""}, {""review"": ""Top-tier quality with absolutely no issues so far. The heels fits perfectly into my daily routine."", ""sentiment"": ""positive""}, {""review"": ""One of the best products I’ve used in this category. The heels fits perfectly into my daily routine."", ""sentiment"": ""positive""}, {""review"": ""It’s fine, but feels a bit plain at times. Using the heels feels okay overall."", ""sentiment"": ""neutral""}, {""review"": ""The quality feels a bit disappointing. The heels could use more refinement."", ""sentiment"": ""negative""}]"
